### ISSUE TITLE
authentification issues - 401 Unauthorized

### ISSUE THREAD

**Issue by posuch** [fedorpatlin/sapccmsget#5]
when using this binary I get authentification errors like:

```
13 -504631632.904266894 10.233.38.133 -> 10.233.38.133 TCP 74 50013 > 60500 [SYN, ACK] Seq=0 Ack=1 Win=43690 Len=0 MSS=65495 SACK_PERM=1 TSval=254970634 TSecr=254970633 WS=128
 14 10.729577548 10.233.38.133 -> 10.203.38.133 TCP 66 60500 > 50013 [ACK] Seq=1 Ack=1 Win=43776 Len=0 TSval=254970634 TSecr=254970634
 15 10.729918307 10.233.38.133 -> 10.233.38.133 HTTP/XML 698 POST /SAPCCMS.cgi HTTP/1.1
 16 10.729978936 10.233.38.133 -> 10.233.38.133 TCP 66 50013 > 60500 [ACK] Seq=1 Ack=633 Win=45056 Len=0 TSval=254970634 TSecr=254970634
 17 10.730160110 10.233.38.133 -> 10.233.38.133 HTTP/XML 853 HTTP/1.1 401 Unauthorized
 18 10.730170500 10.233.38.133 -> 10.233.38.133 TCP 66 60500 > 50013 [ACK] Seq=633 Ack=788 Win=45312 Len=0 TSval=254970634 TSecr=254970634
```

output is the same - element not found ( regardless if run by hand or zabbix agent )

```
[root@host ~]# ./sapccmsget -h host -n 00 -s SID -e 'SID\host_SID_00\\R3Services\\Dialog\\ResponseTime'
2020/09/10 09:16:19 Element not found by name SID\host_SID_00\\R3Services\\Dialog\\ResponseTime
```

Guess this might go with the SAP endpoint - last lines of output:

```
curl http://host:50013/SAPCCMS.cgi?wsdl

<service name="SAPControl">
 <documentation>The SAPControl webservice can be used to control and monitor a single SAP instance. Some methods may fail with HTTP error 401 without user authentication. Use HTTP basic authentication (UTF8 encoded) to provide OS user credentials. By default the service uses port 5$(SAPSYSTEM)13 for HTTP and 5$(SAPSYSTEM)14 for HTTPS (if SSL is configured for the instance), this might be overridden in etc/service by specifying sapctrl$(SAPSYSTEM) and sapctrls$(SAPSYSTEM).</documentation>
 <port name="SAPControl" binding="tns:SAPControl">
  <SOAP:address location="http://host:50013/SAPControl.cgi"/>
 </port>
</service>
```

Apparently this need basic authentification - guys how do you tackle that ?

Thanks

**Comment by leonardoHaubrich** [comment]
good afternoon, i also have the same problem, any solution?

**Comment by Vladdun** [comment]
change instance parameter 
service/protectedwebmethods = NONE
or
service/protectedwebmethods = SDEFAULT -GetAlertTree -MtRead .....all metods you need

**Comment by posuch** [comment]
This will not get through security guys. Shame. At least we know what are the limits.

**Comment by Vladdun** [comment]
service/protectedwebmethods = SDEFAULT -PerfRead -MtGetTidByName      - enough for me. It allow read perfomance and metric by name
after restart service sapcontrol (without restart all sap)
sapcontrol -nr <NrInst> -function RestartService
